{
  "nav": {
    "home": "Inicio",
    "projects": "Proyectos",
    "about": "Sobre mí",
    "contact": "Contacto",
    "getInTouch": "Contactar",
    "embeddedTag": "/ ",
    "menu": "Navegación"
  },
  "hero": {
    "eyebrow": "Electrónica · Programación · Robótica",
    "viewProjects": "Ver p  royectos",
    "aboutMe": "Sobre mí"
  },
  "featured": {
    "eyebrow": "",
    "title": "Proyectos destacados",
    "description": "Los mejores proyectos en los que he trabajado, con los que me siento más orgulloso.",
    "allProjects": "Todos los proyectos"
  },
  "skills": {
    "eyebrow": "Capacidades",
    "title": "Stack de ingeniería",
    "description": "Las tecnologías que uso para construir mis proyectos."
  },
  "cta": {
    "eyebrow": "Colaborar",
    "title": "¿Construís algo con precisión?",
    "description": "Abierto a roles en electrónica, diseño de PCBs, programación y robótica — o colaboraciones técnicas en productos embebidos ambiciosos.",
    "button": "Iniciar conversación"
  },
  "projects": {
    "eyebrow": "Portfolio",
    "title": "Proyectos",
    "description": "Electrónica, programación, robótica y diseño de PCBs — documentados con especificaciones, métricas y notas de arquitectura.",
    "empty": "Aún no hay proyectos. Agregá un archivo JSON en content/projects/.",
    "noMatches": "No hay proyectos que coincidan con estos filtros.",
    "filterAll": "Todos",
    "backToProjects": "Todos los proyectos",
    "notFoundTitle": "Proyecto no encontrado",
    "notFoundDescription": "Este proyecto pudo haber sido movido o eliminado."
  },
  "status": {
    "completed": "completado",
    "in-progress": "en progreso",
    "archived": "archivado"
  },
  "projectDetail": {
    "overview": "Resumen",
    "technical": "Especificaciones",
    "metrics": "Métricas",
    "gallery": "Galería",
    "writeup": "Profundización",
    "technicalTitle": "Especificaciones técnicas",
    "metricsTitle": "Resultados y métricas",
    "deepDive": "Profundización",
    "status": "Estado",
    "date": "Fecha",
    "stack": "Stack",
    "viewSource": "Ver código",
    "liveDemo": "Demo en vivo",
    "sectionsNav": "Secciones de la página"
  },
  "about": {
    "metaTitle": "Sobre mí",
    "metaDescription": "Sobre {name} — {title}.",
    "eyebrow": "Perfil",
    "title": "Sobre mí",
    "experience": "Experiencia",
    "principles": "Principios"
  },
  "contact": {
    "metaTitle": "Contacto",
    "metaDescription": "Contactá a {name}.",
    "eyebrow": "Contacto",
    "title": "Conectemos",
    "intro": "¿Te interesan roles en electrónica, diseño de PCBs, programación o robótica? Escribime directamente — suelo responder en pocos días.",
    "emailTitle": "Email",
    "emailDescription": "Ideal para consultas detalladas",
    "socialTitle": "Redes",
    "socialDescription": "Código y perfil profesional",
    "github": "GitHub",
    "linkedin": "LinkedIn",
    "formNote": ""
  },
  "footer": {
    "builtWith": "Construido con Next.js"
  },
  "language": {
    "label": "Idioma",
    "ariaLabel": "Seleccionar idioma",
    "es": "ES",
    "en": "EN"
  }
}
