{
  "nav": {
    "home": "Home",
    "projects": "Projects",
    "about": "About",
    "contact": "Contact",
    "getInTouch": "Get in touch",
    "embeddedTag": "/ ",
    "menu": "Navigation"
  },
  "hero": {
    "eyebrow": "Electronics · Programming · Robotics",
    "viewProjects": "View projects",
    "aboutMe": "About me"
  },
  "featured": {
    "eyebrow": "",
    "title": "Featured projects",
    "description": "The best projects I have worked on, with the ones I feel most proud of.",
    "allProjects": "All projects"
  },
  "skills": {
    "eyebrow": "Capabilities",
    "title": "Engineering stack",
    "description": "The technologies I use to build my projects."
  },
  "cta": {
    "eyebrow": "Collaborate",
    "title": "Building something precise?",
    "description": "Open to electronics, PCB design, programming, and robotics roles — or technical collaborations on ambitious embedded products.",
    "button": "Start a conversation"
  },
  "projects": {
    "eyebrow": "Portfolio",
    "title": "Projects",
    "description": "Electronics, programming, robotics, and PCB design — documented with specs, metrics, and architecture notes.",
    "empty": "No projects yet. Add a JSON file to content/projects/.",
    "noMatches": "No projects match these filters.",
    "filterAll": "All",
    "backToProjects": "All projects",
    "notFoundTitle": "Project not found",
    "notFoundDescription": "This project may have been moved or removed."
  },
  "status": {
    "completed": "completed",
    "in-progress": "in progress",
    "archived": "archived"
  },
  "projectDetail": {
    "overview": "Overview",
    "technical": "Technical",
    "metrics": "Metrics",
    "gallery": "Gallery",
    "writeup": "Write-up",
    "technicalTitle": "Technical specifications",
    "metricsTitle": "Results & metrics",
    "deepDive": "Deep dive",
    "status": "Status",
    "date": "Date",
    "stack": "Stack",
    "viewSource": "View source",
    "liveDemo": "Live demo",
    "sectionsNav": "Page sections"
  },
  "about": {
    "metaTitle": "About",
    "metaDescription": "About {name} — {title}.",
    "eyebrow": "Profile",
    "title": "About",
    "experience": "Experience",
    "principles": "Principles"
  },
  "contact": {
    "metaTitle": "Contact",
    "metaDescription": "Get in touch with {name}.",
    "eyebrow": "Contact",
    "title": "Let's connect",
    "intro": "Interested in electronics, PCB design, programming, or robotics roles — or technical collaborations on ambitious embedded products? Reach out directly — I typically respond within a few days.",
    "emailTitle": "Email",
    "emailDescription": "Best for detailed inquiries",
    "socialTitle": "Social",
    "socialDescription": "Code and professional profile",
    "github": "GitHub",
    "linkedin": "LinkedIn",
    "formNote": ""
  },
  "footer": {
    "builtWith": "Built with Next.js"
  },
  "language": {
    "label": "Language",
    "ariaLabel": "Select language",
    "es": "ES",
    "en": "EN"
  }
}
